{
  "artifact_policy": "digest_only_source_free",
  "backend_equivalence_passed": true,
  "baseline_backend_sequence": [
    "reference-cpu",
    "reference-cpu",
    "reference-cpu",
    "reference-cpu"
  ],
  "blocked_claims": [
    "native_performance_parity",
    "vendor_compiler_replacement",
    "broad_source_code_parsing",
    "arbitrary_third_party_backend_execution",
    "device_access",
    "generated_artifact_execution",
    "production_triton_integration"
  ],
  "broad_source_parser_claim": false,
  "catalog_entry_count": 7,
  "claim_contract": "objective_alpha.research_claim.digest_snapshot.v0",
  "claim_id": "objective_alpha_universal_compute_research_claim",
  "claim_metadata_digest": "1b0640460a9f33f469ef04c6b2a914d81c649da6a86ba17023a2edd2d95158f8",
  "claim_passed": true,
  "claim_scope": "objective_alpha_public_bundle_catalog_and_mixed_runtime_proof",
  "claim_status": "supported_for_objective_alpha_research_scope",
  "evidence": [
    {
      "artifact_id": "objective_alpha_public_proof_bundle",
      "digest": "911172ad9c54743af6ef69d08f269c5d43593825ecb49f90afd491d2fab38aa2",
      "status": "accepted"
    },
    {
      "artifact_id": "objective_alpha_public_proof_bundle_gate",
      "digest": "04c3ff326065810f0c4440e65bde1587f59bb580803325df62744d87ab5c604b",
      "status": "accepted"
    },
    {
      "artifact_id": "objective_alpha_evidence_extension_policy",
      "digest": "4c8dc9cd62201e414cf653c9f2e64a773d54df83835167df4e224791394e3cdf",
      "status": "accepted"
    },
    {
      "artifact_id": "objective_alpha_public_evidence_catalog",
      "digest": "830c1bcd65f36f9675e7aaf195105f19195808fe2dcf21a1166ac0c1d4c6982a",
      "status": "accepted"
    },
    {
      "artifact_id": "objective_alpha_public_evidence_catalog_admission_gate",
      "digest": "396b4647debd2a0f6cb7ac9f3c58cb86ac98c05160b3b5a797234bce1d6d77ea",
      "status": "accepted"
    },
    {
      "artifact_id": "source_intent_mixed_runtime_public_proof_bundle",
      "digest": "baf6d1b6939d7653378a9ad44415865db94532b46242e45a07216adab4f3f05a",
      "status": "accepted"
    }
  ],
  "evidence_count": 6,
  "mixed_backend_sequence": [
    "systolic-sim",
    "vector-sim",
    "vector-sim",
    "vector-sim"
  ],
  "native_performance_claim": false,
  "operation_families": [
    "matmul",
    "softmax",
    "reduction",
    "elementwise"
  ],
  "public_bundle_entry_count": 16,
  "public_evidence_entry_count": 23,
  "reference_correctness_passed": true,
  "required_invariants": [
    "public_proof_bundle_full",
    "public_proof_bundle_gate_passed",
    "extension_policy_passed",
    "public_evidence_catalog_passed",
    "public_evidence_catalog_admission_gate_passed",
    "source_intent_mixed_runtime_public_proof_passed",
    "backend_equivalence_passed",
    "reference_correctness_passed",
    "digest_only_source_free_claim"
  ],
  "schema_version": "tuc.objective_alpha_research_claim_report.v0",
  "supported_claims": [
    "hardware_independent_compute_intent_current_research_slice",
    "capability_planned_trusted_runtime_execution",
    "mixed_backend_public_semantics_preserved",
    "digest_only_reviewable_public_evidence",
    "rfc_bound_public_evidence_growth"
  ],
  "trusted_runtime_backends": [
    "reference-cpu",
    "systolic-sim",
    "vector-sim"
  ],
  "vendor_replacement_claim": false
}
